{
  "artifact_type": "review.control",
  "schema_version": "1.0.0",
  "status": "approved",
  "source_contracts": {
    "requirements": "requirements.control.json",
    "design": "design.control.json",
    "goal": "goal.control.json",
    "plan": "plan.control.json"
  },
  "registry_bindings": {
    "answer_method_key": "implementation-spine",
    "selected_agent_workflow": "superpowers-dispatching-parallel-agents"
  },
  "review_checks": [
    {
      "check_id": "design-answer-method",
      "status": "pass",
      "evidence": [
        "design.control.json preserves implementation-spine answer method and avoids component-inventory-completion"
      ]
    },
    {
      "check_id": "required-answer-path",
      "status": "pass",
      "evidence": [
        "goal/plan/runtime required steps S1-S10 are aligned and work packages cover every runtime step"
      ]
    },
    {
      "check_id": "work-assignment",
      "status": "pass",
      "evidence": [
        "plan/control registry binds superpowers-dispatching-parallel-agents with Parallel subagent-driven work"
      ]
    },
    {
      "check_id": "horizon-authority",
      "status": "pass",
      "evidence": [
        "approved JSON-only migration work remains in this run; Markdown compatibility is explicitly non-goal"
      ]
    },
    {
      "check_id": "final-observer",
      "status": "pass",
      "evidence": [
        "JSON-only focused tests and full tests pass before runtime verification"
      ]
    }
  ],
  "semantic_base_ref": {
    "id": "semantic-base:2026-06-09-json-only-control-facts-migration",
    "hash": "sha256:5913363ce879217b09bd515dcc8c7863a43bc0a9886ca13c9eae4db837b22f0a"
  },
  "approved_control_hashes": {
    "requirements.control.json": "sha256:aa87476c2f5c5dd31e834d0a5e8828b0abe695d2b50cf4a08f4294027ef44566",
    "design.control.json": "sha256:a3f5daa6d9afdc0144f4f876317c29668bc28354f312f45a3b0d23d810d48de3",
    "goal.control.json": "sha256:35642633514262682b2263c99c5114cb9ce66dbe8a556a515cdd299705564f6e",
    "plan.control.json": "sha256:b40612dca7069ee6708428b4dc12a92decfa70f825fe82cbd4e6a0a8fc20c66b"
  }
}
